{
  "fixture_id": "SDK-WF-SCAN-PREVIEW-0001",
  "workflow": "scan_preview",
  "strict": true,
  "input": {
    "qr_string_ref": "conformance/vectors/qr/POS-QR-001.json#/input/qr_string",
    "trust_pub_b64_ref": "conformance/vectors/cose/POS-COSE-001.json#/input/pub_b64"
  },
  "expect": {
    "status": "Verified",
    "diag": [],
    "cose_b64": "present",
    "store_mutation": "none"
  },
  "meta": {
    "desc": "Valid scan with explicit trusted public key verifies without mutating client storage."
  }
}
