{
  "fixture_id": "SDK-WF-SCAN-ACCEPT-0001",
  "workflow": "scan_accept",
  "strict": true,
  "input": {
    "qr_string_ref": "conformance/vectors/qr/POS-QR-001.json#/input/qr_string",
    "trust_pub_b64_ref": "conformance/vectors/cose/POS-COSE-001.json#/input/pub_b64"
  },
  "expect": {
    "status": "Accepted",
    "diag": [],
    "cose_b64": "present",
    "store_mutation": "accepted_scan_inserted",
    "accepted_record_count": 1
  },
  "meta": {
    "desc": "Valid scan with explicit trusted public key verifies and persists exactly one accepted scan record."
  }
}
